{
  "description": "The 10 KiB cut falls inside a two-byte character, so the tail starts at the next character and keeps 10,239 bytes.",
  "known_monitors": [
    {
      "token": "abcdefghijklmnopqrstuvwxyz"
    }
  ],
  "request": {
    "method": "POST",
    "path": "/ping/abcdefghijklmnopqrstuvwxyz",
    "headers": {
      "Content-Type": "text/plain"
    },
    "body_repeat": {
      "text": "aé",
      "count": 3414
    }
  },
  "response": {
    "status": 200,
    "headers": {
      "Content-Type": "text/plain; charset=utf-8"
    },
    "body": "OK\n"
  },
  "event": {
    "v": 1,
    "id": "$any",
    "kind": "success",
    "received_at": "$any",
    "monitor": {
      "token": "abcdefghijklmnopqrstuvwxyz"
    },
    "run_id": null,
    "exit_code": null,
    "unverified": false,
    "source": "http",
    "idempotency_key": null,
    "metrics": {},
    "metrics_rejected": [],
    "output": "aéaéaéaéaéaéaéaéaéaéaéaéaéaéaéaéaéaéaéaéaéaéaéaéaéaéaéaéaéaéaéaéaéaéaéaéaéaéaéaéaéaéaéaéaéaéaéaéaéaéaéaéaéaéaéaéaéaéaéaéaéaéaéaéaéaéaéaéaéaéaéaéaéaéaéaéaéaéaéaéaéaéaéaéaéaéaéaéaéaéaéaéaéaéaéaéaéaéaéaéaéaéaéaéaéaéaéaéaéaéaéaéaéaéaéaéaéaéaéaéaéaéaéaéaéaéaéaéaéaéaéaéaéaéaéaéaéaéaéaéaéaéaéaéaéaéaéaéaéaéaéaéaéaéaéaéaéaéaéaéaéaéaéaéaéaéaéaéaéaéaéaéaéaéaéaéaéaéaéaéaéaéaéaéaéaéaéaéaéaéaéaéaéaéaéaéaéaéaéaéaéaéaéaéaéaéaéaéaéaéaéaéaéaéaéaéaéaéaéaéaéaéaéaéaéaéaéaéaéaéaéaéaéaéaéaéaéaéaéaéaéaéaéaéaéaéaéaéaéaéaéaéaéaéaéaéaéaéaéaéaéaéaéaéaéaéaéaéaéaéaéaéaéaéaéaéaéaéaéaéaéaéaéaéaéaéaéaéaéaéaéaéaéaéaéaéaéaéaéaéaéaéaéaéaéaéaéaéaéaéaéaéaéaéaéaéaéaéaéaéaéaéaéaéaéaéaéaéaéaéaéaéaéaéaéaéaéaéaéaéaéaéaéaéaéaéaéaéaéaéaéaéaéaéaéaéaéaéaéaéaéaéaéaéaéaéaéaéaéaéaéaéaéaéaéaéaéaéaéaéaéaéaéaéaéaéaéaéaéaéaéaéaéaéaéaéaéaéaéaéaéaéaéaéaéaéaéaéaéaéaéaéaéaéaéaéaéaéaéaéaéaéaéaéaéaéaéaéaéaéaéaéaéaéaéaéaéaéaéaéaéaéaéaéaéaéaéaéaéaéaéaéaéaéaéaéaéaéaéaéaéaéaéaéaéaéaéaéaéaéaéaéaéaéaéaéaéaéaéaéaéaéaéaéaéaéaéaéaéaéaéaéaéaéaéaéaéaéaéaéaéaéaéaéaéaéaéaéaéaéaéaéaéaéaéaéaéaéaéaéaéaéaéaéaéaéaéaéaéaéaéaéaéaéaéaéaéaéaéaéaéaéaéaéaéaéaéaéaéaéaéaéaéaéaéaéaéaéaéaéaéaéaéaéaéaéaéaéaéaéaéaéaéaéaéaéaéaéaéaéaéaéaéaéaéaéaéaéaéaéaéaéaéaéaéaéaéaéaéaéaéaéaéaéaéaéaéaéaéaéaéaéaéaéaéaéaéaéaéaéaéaéaéaéaéaéaéaéaéaéaéaéaéaéaéaéaéaéaéaéaéaéaéaéaéaéaéaéaéaéaéaéaéaéaéaéaéaéaéaéaéaéaéaéaéaéaéaéaéaéaéaéaéaéaéaéaéaéaéaéaéaéaéaéaéaéaéaéaéaéaéaéaéaéaéaéaéaéaéaéaéaéaéaéaéaéaéaéaéaéaéaéaéaéaéaéaéaéaéaéaéaéaéaéaéaéaéaéaéaéaéaéaéaéaéaéaéaéaéaéaéaéaéaéaéaéaéaéaéaéaéaéaéaéaéaéaéaéaéaéaéaéaéaéaéaéaéaéaéaéaéaéaéaéaéaéaéaéaéaéaéaéaéaéaéaéaéaéaéaéaéaéaéaéaéaéaéaéaéaéaéaéaéaéaéaéaéaéaéaéaéaéaéaéaéaéaéaéaéaéaéaéaéaéaéaéaéaéaéaéaéaéaéaéaéaéaéaéaéaéaéaéaéaéaéaéaéaéaéaéaéaéaéaéaéaéaéaéaéaéaéaéaéaéaéaéaéaéaéaéaéaéaéaéaéaéaéaéaéaéaéaéaéaéaéaéaéaéaéaéaéaéaéaéaéaéaéaéaéaéaéaéaéaéaéaéaéaéaéaéaéaéaéaéaéaéaéaéaéaéaéaéaéaéaéaéaéaéaéaéaéaéaéaéaéaéaéaéaéaéaéaéaéaéaéaéaéaéaéaéaéaéaéaéaéaéaéaéaéaéaéaéaéaéaéaéaéaéaéaéaéaéaéaéaéaéaéaéaéaéaéaéaéaéaéaéaéaéaéaéaéaéaéaéaéaéaéaéaéaéaéaéaéaéaéaéaéaéaéaéaéaéaéaéaéaéaéaéaéaéaéaéaéaéaéaéaéaéaéaéaéaéaéaéaéaéaéaéaéaéaéaéaéaéaéaéaéaéaéaéaéaéaéaéaéaéaéaéaéaéaéaéaéaéaéaéaéaéaéaéaéaéaéaéaéaéaéaéaéaéaéaéaéaéaéaéaéaéaéaéaéaéaéaéaéaéaéaéaéaéaéaéaéaéaéaéaéaéaéaéaéaéaéaéaéaéaéaéaéaéaéaéaéaéaéaéaéaéaéaéaéaéaéaéaéaéaéaéaéaéaéaéaéaéaéaéaéaéaéaéaéaéaéaéaéaéaéaéaéaéaéaéaéaéaéaéaéaéaéaéaéaéaéaéaéaéaéaéaéaéaéaéaéaéaéaéaéaéaéaéaéaéaéaéaéaéaéaéaéaéaéaéaéaéaéaéaéaéaéaéaéaéaéaéaéaéaéaéaéaéaéaéaéaéaéaéaéaéaéaéaéaéaéaéaéaéaéaéaéaéaéaéaéaéaéaéaéaéaéaéaéaéaéaéaéaéaéaéaéaéaéaéaéaéaéaéaéaéaéaéaéaéaéaéaéaéaéaéaéaéaéaéaéaéaéaéaéaéaéaéaéaéaéaéaéaéaéaéaéaéaéaéaéaéaéaéaéaéaéaéaéaéaéaéaéaéaéaéaéaéaéaéaéaéaéaéaéaéaéaéaéaéaéaéaéaéaéaéaéaéaéaéaéaéaéaéaéaéaéaéaéaéaéaéaéaéaéaéaéaéaéaéaéaéaéaéaéaéaéaéaéaéaéaéaéaéaéaéaéaéaéaéaéaéaéaéaéaéaéaéaéaéaéaéaéaéaéaéaéaéaéaéaéaéaéaéaéaéaéaéaéaéaéaéaéaéaéaéaéaéaéaéaéaéaéaéaéaéaéaéaéaéaéaéaéaéaéaéaéaéaéaéaéaéaéaéaéaéaéaéaéaéaéaéaéaéaéaéaéaéaéaéaéaéaéaéaéaéaéaéaéaéaéaéaéaéaéaéaéaéaéaéaéaéaéaéaéaéaéaéaéaéaéaéaéaéaéaéaéaéaéaéaéaéaéaéaéaéaéaéaéaéaéaéaéaéaéaéaéaéaéaéaéaéaéaéaéaéaéaéaéaéaéaéaéaéaéaéaéaéaéaéaéaéaéaéaéaéaéaéaéaéaéaéaéaéaéaéaéaéaéaéaéaéaéaéaéaéaéaéaéaéaéaéaéaéaéaéaéaéaéaéaéaéaéaéaéaéaéaéaéaéaéaéaéaéaéaéaéaéaéaéaéaéaéaéaéaéaéaéaéaéaéaéaéaéaéaéaéaéaéaéaéaéaéaéaéaéaéaéaéaéaéaéaéaéaéaéaéaéaéaéaéaéaéaéaéaéaéaéaéaéaéaéaéaéaéaéaéaéaéaéaéaéaéaéaéaéaéaéaéaéaéaéaéaéaéaéaéaéaéaéaéaéaéaéaéaéaéaéaéaéaéaéaéaéaéaéaéaéaéaéaéaéaéaéaéaéaéaéaéaéaéaéaéaéaéaéaéaéaéaéaéaéaéaéaéaéaéaéaéaéaéaéaéaéaéaéaéaéaéaéaéaéaéaéaéaéaéaéaéaéaéaéaéaéaéaéaéaéaéaéaéaéaéaéaéaéaéaéaéaéaéaéaéaéaéaéaéaéaéaéaéaéaéaéaéaéaéaéaéaéaéaéaéaéaéaéaéaéaéaéaéaéaéaéaéaéaéaéaéaéaéaéaéaéaéaéaéaéaéaéaéaéaéaéaéaéaéaéaéaéaéaéaéaéaéaéaéaéaéaéaéaéaéaéaéaéaéaéaéaéaéaéaéaéaéaéaéaéaéaéaéaéaéaéaéaéaéaéaéaéaéaéaéaéaéaéaéaéaéaéaéaéaéaéaéaéaéaéaéaéaéaéaéaéaéaéaéaéaéaéaéaéaéaéaéaéaéaéaéaéaéaéaéaéaéaéaéaéaéaéaéaéaéaéaéaéaéaéaéaéaéaéaéaéaéaéaéaéaéaéaéaéaéaéaéaéaéaéaéaéaéaéaéaéaéaéaéaéaéaéaéaéaéaéaéaéaéaéaéaéaéaéaéaéaéaéaéaéaéaéaéaéaéaéaéaéaéaéaéaéaéaéaéaéaéaéaéaéaéaéaéaéaéaéaéaéaéaéaéaéaéaéaéaéaéaéaéaéaéaéaéaéaéaéaéaéaéaéaéaéaéaéaéaéaéaéaéaéaéaéaéaéaéaéaéaéaéaéaéaéaéaéaéaéaéaéaéaéaéaéaéaéaéaéaéaéaéaéaéaéaéaéaéaéaéaéaéaéaéaéaéaéaéaéaéaéaéaéaéaéaéaéaéaéaéaéaéaéaéaéaéaéaéaéaéaéaéaéaéaéaéaéaéaéaéaéaéaéaéaéaéaéaéaéaéaéaéaéaéaéaéaéaéaéaéaéaéaéaéaéaéaéaéaéaéaéaéaéaéaéaéaéaéaéaéaéaéaéaéaéaéaéaéaéaéaéaéaéaéaéaéaéaéaéaéaéaéaéaéaéaéaéaéaéaéaéaéaéaéaéaéaéaéaéaéaéaéaéaéaéaéaéaéaéaéaéaéaéaéaéaéaéaéaéaéaéaéaéaéaéaéaéaéaéaéaéaéaéaéaéaéaéaéaéaéaéaéaéaéaéaéaéaéaéaéaéaéaéaéaéaéaéaéaéaéaéaéaéaéaéaéaéaéaéaéaéaéaéaéaéaéaéaéaéaéaéaéaéaéaéaéaéaéaéaéaéaéaéaéaéaéaéaéaéaéaéaéaéaéaéaéaéaéaéaéaéaéaéaéaéaéaéaéaéaéaéaéaéaéaéaéaéaéaéaéaéaéaéaéaéaéaéaéaéaéaéaéaéaéaéaéaéaéaéaéaéaéaéaéaéaéaéaéaéaéaéaéaéaéaéaéaéaéaéaéaéaéaéaéaéaéaéaéaéaéaéaéaéaéaéaéaéaéaéaéaéaéaéaéaéaéaéaéaéaéaéaéaéaéaéaéaéaéaéaéaéaéaéaéaéaéaéaéaéaéaéaéaéaéaéaéaéaéaéaéaéaéaéaéaéaéaéaéaéaéaéaéaéaéaéaéaéaéaéaéaéaéaéaéaéaéaéaéaéaéaéaéaéaéaéaéaéaéaéaéaéaéaéaéaéaéaéaéaéaéaéaéaéaéaéaéaéaéaéaéaéaéaéaéaéaéaéaéaéaéaéaéaéaéaéaéaéaéaéaéaéaéaéaéaéaéaéaéaéaéaéaéaéaéaéaéaéaéaéaéaéaéaéaéaéaéaéaéaéaéaéaéaéaéaéaéaéaéaéaéaéaéaéaéaéaéaéaéaéaéaéaéaéaéaéaéaéaéaéaéaéaéaéaéaéaéaéaéaéaéaéaéaéaéaéaéaéaéaéaéaéaéaéaéaéaéaéaéaéaéaéaéaéaéaéaéaéaéaéaéaéaéaéaéaéaéaéaéaéaéaéaéaéaéaéaéaéaéaéaéaéaéaéaéaéaéaéaéaéaéaéaéaéaéaéaéaéaéaéaéaéaéaéaéaéaéaéaéaéaéaéaéaéaéaéaéaéaéaéaéaéaéaéaéaéaéaéaéaéaéaéaéaéaéaéaéaéaéaéaéaéaéaéaéaéaéaéaéaéaéaéaéaéaéaéaéaéaéaéaéaéaéaéaéaéaéaéaéaéaéaéaéaéaéaéaéaéaéaéaéaéaéaéaéaéaéaéaéaéaéaéaéaéaéaéaéaéaéaéaéaéaéaéaéaéaéaéaéaéaéaéaéaéaéaéaéaéaéaéaéaéaéaéaéaéaéaéaéaéaéaéaéaéaéaéaéaéaéaéaéaéaéaéaéaéaéaéaéaéaéaéaéaéaéaéaéaéaéaéaéaéaéaéaéaéaéaéaéaéaéaéaéaéaéaéaéaéaéaéaéaéaéaéaéaéaéaéaéaéaéaéaéaéaéaéaéaéaéaéaéaéaéaéaéaéaéaéaéaéaéaéaéaéaéaéaéaéaéaéaéaéaéaéaéaéaéaéaéaéaéaéaéaéaéaéaéaéaéaéaéaéaéaéaéaéaéaéaéaéaéaéaéaéaéaéaéaéaéaéaéaéaéaéaéaéaéaéaéaéaéaéaéaéaéaéaéaéaéaéaéaéaéaéaéaéaéaéaéaéaéaéaéaéaéaéaéaéaéaéaéaéaéaéaéaéaéaéaéaéaéaéaéaéaéaéaéaéaéaéaéaéaéaéaéaéaéaéaéaéaéaéaéaéaéaéaéaéaéaéaéaéaéaéaéaéaéaéaéaéaéaéaéaéaéaéaéaéaéaéaéaéaéaéaéaéaéaéaéaéaéaéaéaéaéaéaéaéaéaéaéaéaéaéaéaéaéaéaéaéaéaéaéaéaéaéaéaéaéaéaéaéaéaéaéaéaéaéaéaéaéaéaéaéaéaéaéaéaéaéaéaéaéaéaéaéaéaéaéaéaéaéaéaéaéaéaéaéaéaéaéaéaéaéaéaéaéaéaéaéaéaéaéaéaéaéaéaéaéaéaéaéaéaéaéaéaéaéaéaéaéaéaéaéaéaéaéaéaéaéaéaéaéaéaéaéaéaéaéaéaéaéaéaéaéaéaéaéaéaéaéaéaéaéaéaéaéaéaéaéaéaéaéaéaéaéaéaéaéaéaéaéaéaéaéaéaéaéaéaéaéaéaéaéaéaéaéaéaéaéaéaéaéaéaéaéaéaéaéaéaéaéaéaéaéaéaéaéaéaéaéaéaéaéaéaéaéaéaéaéaéaéaéaéaéaéaéaéaéaéaéaéaéaéaéaéaéaéaéaéaéaéaéaéaéaéaéaéaéaéaéaéaéaéaéaéaéaéaéaéaéaéaéaéaéaéaéaéaéaéaéaéaéaéaéaéaéaéaéaéaéaéaéaéaéaéaéaéaéaéaéaéaéaéaéaéaéaéaéaéaéaéaéaéaéaéaéaéaéaéaéaéaéaéaéaéaéaéaéaéaéaéaéaéaéaéaéaéaéaéaéaéaéaéaéaéaéaéaéaéaéaéaéaéaéaéaéaéaéaéaéaéaéaéaéaéaéaéaéaéaéaéaéaéaéaéaéaéaéaéaéaéaéaéaéaéaéaéaéaéaéaéaéaéaéaéaéaéaéaéaéaéaéaéaéaéaéaéaéaéaéaéaéaéaéaéaéaéaéaéaéaéaéaéaéaéaé",
    "output_truncated": true
  }
}
