{
  "description": "A ping for a token the receiver does not know is accepted and marked unverified.",
  "known_monitors": [],
  "request": {
    "method": "GET",
    "path": "/ping/abcdefghijklmnopqrstuvwxyz",
    "headers": {}
  },
  "response": {
    "status": 200,
    "headers": {
      "Content-Type": "text/plain; charset=utf-8"
    },
    "body": "OK\n"
  },
  "event": {
    "v": 1,
    "id": "$any",
    "kind": "success",
    "received_at": "$any",
    "monitor": {
      "token": "abcdefghijklmnopqrstuvwxyz"
    },
    "run_id": null,
    "exit_code": null,
    "unverified": true,
    "source": "http",
    "idempotency_key": null,
    "metrics": {},
    "metrics_rejected": [],
    "output": null,
    "output_truncated": false
  }
}
